{
  "$schema": "https://yehyakin.github.io/kin-design-system/versions/v3.0.2/schemas/manifest.schema.json",
  "schema_version": "2.0.0",
  "kind": "kin-agent-distribution",
  "artifact_status": "generated-derivative",
  "generated": true,
  "normative": false,
  "publication": {
    "state": "registry-controlled",
    "public_locators": "registry-authoritative"
  },
  "kin_version": "3.0.2",
  "release_status": "released",
  "latest_stable_contract": "3.0.2",
  "channel": "versioned",
  "source": {
    "contract_path": "DESIGN.md",
    "checksum_algorithm": "sha256",
    "checksum": "0a150644e93087d5aeee90ee0c6cc3084efaab40edb654ff0f5aaaf3d2016510",
    "input_set_checksum": "9e30554d18ee6454c546d37b65666cc64fc1f390a7c7545d027aea8db9cd6d7d",
    "ref": "v3.0.2",
    "revision_status": "immutable",
    "inputs": [
      {
        "path": "DELIVERY.md",
        "role": "normative-contract",
        "sha256": "8942e07b5e686056abc637551ebf64adb7dada15f44c271afe1f3b72129bd05d"
      },
      {
        "path": "DESIGN.md",
        "role": "normative-contract",
        "sha256": "0a150644e93087d5aeee90ee0c6cc3084efaab40edb654ff0f5aaaf3d2016510"
      },
      {
        "path": "components/catalog.json",
        "role": "machine-catalog",
        "sha256": "01abf78aa877b9eda97d3d34e5a2583df8ee334c99f6bf7d31b73063c70347a0"
      },
      {
        "path": "distribution/locales/en.json",
        "role": "informative-translation-input",
        "sha256": "e67b6929c02dcbb6f49b899a952b12dbaf4934f39051216174a8584cdd6717fd"
      },
      {
        "path": "distribution/locales/zh-CN.json",
        "role": "informative-translation-input",
        "sha256": "a056f50748c6cb4b68b999be8a19686e63b494e83b1bb779504bd131af2187ee"
      },
      {
        "path": "distribution/profiles.json",
        "role": "distribution-profile-input",
        "sha256": "90ad0b3ad644de8888629d4f9de7d1c2aa3e3f5fd77dbc2de19bb3f1b3d6735e"
      },
      {
        "path": "distribution/rules.json",
        "role": "distribution-rule-input",
        "sha256": "7675ed8a1f4bac26abcdd34c587b0933b4a33c5be58138b9464a5c89cb1db7c6"
      },
      {
        "path": "distribution/schemas/alias-manifest.schema.json",
        "role": "distribution-schema",
        "sha256": "4b4dd4013d4fee7f37097e3d2350f160b71537423b0e38c5193818531d76fd75"
      },
      {
        "path": "distribution/schemas/locale-source.schema.json",
        "role": "distribution-schema",
        "sha256": "3b0ec86b17a420b26782503c21ed2956721508d48fc1ae27f54fc05162c802f1"
      },
      {
        "path": "distribution/schemas/manifest.schema.json",
        "role": "distribution-schema",
        "sha256": "1176bdf2ca5c88d46ff1f7d297cd28361e8f9b7b642dc15b2387468bc3c27cc3"
      },
      {
        "path": "distribution/schemas/profiles.schema.json",
        "role": "distribution-schema",
        "sha256": "56974fbb2940715351ebe26cc8445023e1bf081f2746e554630491c013a9a7f6"
      },
      {
        "path": "distribution/schemas/rules.schema.json",
        "role": "distribution-schema",
        "sha256": "388b85f6a3da74d23b6e75c7f1fc4126a88dcea5f986e9105cc335c843362869"
      },
      {
        "path": "distribution/schemas/snapshot.schema.json",
        "role": "distribution-schema",
        "sha256": "b6fa947eb814b6dcbca2314c6f06f5db71f685973a58c1e5f5938cb88ecb7b19"
      },
      {
        "path": "distribution/schemas/versions.schema.json",
        "role": "distribution-schema",
        "sha256": "69cae517c42d98526af02f1cebe5191491780812972cf795094c4e73f4b0c40a"
      },
      {
        "path": "integrations/catalog.json",
        "role": "machine-catalog",
        "sha256": "5f8ef6281e876727109af2f4212de71a50669c0c19ee93f3b3e32c39a94898b2"
      },
      {
        "path": "package.json",
        "role": "lifecycle-metadata",
        "sha256": "ef9c64c482d13d5afb02de476f0b42fcddb3f19d04aae4455412c1dcd85bcf2c"
      },
      {
        "path": "pages/catalog.json",
        "role": "machine-catalog",
        "sha256": "ea45c92c32bb2d1d94dda76659f3ab848d4be550e074dfbb2c91fe0ab27cdde1"
      },
      {
        "path": "patterns/ecommerce-operations.md",
        "role": "normative-pattern",
        "sha256": "32b223dfc181e0dbd012aba1c01714f27990bd2b7b3f46e16d6e41525eebdad8"
      },
      {
        "path": "patterns/engineering-canvas.md",
        "role": "normative-pattern",
        "sha256": "7c2045160a464ced6e9ba4461ee63c6d6e95c677398334f19ddb8fb61db97e0a"
      },
      {
        "path": "patterns/information-site.md",
        "role": "normative-pattern",
        "sha256": "b2aaf54a2bbaa5306f84cd53264ee689ab8354056934a650e6e7ae84279bf5c2"
      },
      {
        "path": "patterns/intelligence-workspace.md",
        "role": "normative-pattern",
        "sha256": "8e46e684f95b564a5ce2d659502ccf3cf4a2540866d4dfd95a5b081968622dd8"
      },
      {
        "path": "principles/visual-signature.md",
        "role": "normative-contract",
        "sha256": "f183b339aa098234f2ecff0a755fca72277753c5705b13be76f177c205539d57"
      },
      {
        "path": "tokens/kin.tokens.json",
        "role": "generated-token-source",
        "sha256": "fcc7a7b13e63d76041075ed6f74e7f900bdc31c355fa82add1e25d0ec8050736"
      }
    ]
  },
  "coverage": {
    "level": "compact",
    "complete_contract": false
  },
  "features": {
    "component_recipes": "unavailable"
  },
  "links": {
    "source_raw_base_url": "https://raw.githubusercontent.com/yehyakin/kin-design-system/v3.0.2/",
    "source_human_base_url": "https://github.com/yehyakin/kin-design-system/blob/v3.0.2/",
    "public_base_url": "https://yehyakin.github.io/kin-design-system/versions/v3.0.2/",
    "versions_registry_url": "https://yehyakin.github.io/kin-design-system/versions.json"
  },
  "schemas": {
    "snapshot": {
      "repository_source_path": "distribution/schemas/snapshot.schema.json",
      "bundle_path": "schemas/snapshot.schema.json",
      "public_url": "https://yehyakin.github.io/kin-design-system/versions/v3.0.2/schemas/snapshot.schema.json"
    },
    "manifest": {
      "repository_source_path": "distribution/schemas/manifest.schema.json",
      "bundle_path": "schemas/manifest.schema.json",
      "public_url": "https://yehyakin.github.io/kin-design-system/versions/v3.0.2/schemas/manifest.schema.json"
    },
    "alias_manifest": {
      "repository_source_path": "distribution/schemas/alias-manifest.schema.json",
      "bundle_path": "schemas/alias-manifest.schema.json",
      "public_url": "https://yehyakin.github.io/kin-design-system/versions/v3.0.2/schemas/alias-manifest.schema.json"
    },
    "versions": {
      "repository_source_path": "distribution/schemas/versions.schema.json",
      "bundle_path": "schemas/versions.schema.json",
      "public_url": "https://yehyakin.github.io/kin-design-system/versions/v3.0.2/schemas/versions.schema.json"
    },
    "rules": {
      "repository_source_path": "distribution/schemas/rules.schema.json",
      "bundle_path": "schemas/rules.schema.json",
      "public_url": "https://yehyakin.github.io/kin-design-system/versions/v3.0.2/schemas/rules.schema.json"
    },
    "profiles": {
      "repository_source_path": "distribution/schemas/profiles.schema.json",
      "bundle_path": "schemas/profiles.schema.json",
      "public_url": "https://yehyakin.github.io/kin-design-system/versions/v3.0.2/schemas/profiles.schema.json"
    },
    "locale_source": {
      "repository_source_path": "distribution/schemas/locale-source.schema.json",
      "bundle_path": "schemas/locale-source.schema.json",
      "public_url": "https://yehyakin.github.io/kin-design-system/versions/v3.0.2/schemas/locale-source.schema.json"
    }
  },
  "locales": [
    {
      "id": "en",
      "complete": true,
      "review": {
        "status": "reviewed",
        "reviewers": [
          "@yehyakin"
        ],
        "normative_source_checksum": "28d428a4429c45b5bcc6dc4cfddfd97682ef2f6a2b0297852954be1c247c4fe2",
        "localized_content_checksum": "8cbc0ee2535f738266c73e9f80419076c0da5afad2212a6049408902706f412a"
      }
    },
    {
      "id": "zh-CN",
      "complete": true,
      "review": {
        "status": "reviewed",
        "reviewers": [
          "@yehyakin"
        ],
        "normative_source_checksum": "28d428a4429c45b5bcc6dc4cfddfd97682ef2f6a2b0297852954be1c247c4fe2",
        "localized_content_checksum": "5ce67d168f77941fa5cf023d00f72ffcbc0235a0fcf13c2af5a34fcf93cd2bc2"
      }
    }
  ],
  "modes": [
    {
      "theme": "light",
      "contrast": "normal",
      "locale": "en",
      "artifact_id": "design-en-light"
    },
    {
      "theme": "dark",
      "contrast": "normal",
      "locale": "en",
      "artifact_id": "design-en-dark"
    },
    {
      "theme": "light",
      "contrast": "more",
      "locale": "en",
      "artifact_id": "design-en-light-high-contrast"
    },
    {
      "theme": "dark",
      "contrast": "more",
      "locale": "en",
      "artifact_id": "design-en-dark-high-contrast"
    },
    {
      "theme": "light",
      "contrast": "normal",
      "locale": "zh-CN",
      "artifact_id": "design-zh-cn-light"
    },
    {
      "theme": "dark",
      "contrast": "normal",
      "locale": "zh-CN",
      "artifact_id": "design-zh-cn-dark"
    },
    {
      "theme": "light",
      "contrast": "more",
      "locale": "zh-CN",
      "artifact_id": "design-zh-cn-light-high-contrast"
    },
    {
      "theme": "dark",
      "contrast": "more",
      "locale": "zh-CN",
      "artifact_id": "design-zh-cn-dark-high-contrast"
    }
  ],
  "catalogs": {
    "components": {
      "repository_path": "components/catalog.json",
      "raw_url": "https://raw.githubusercontent.com/yehyakin/kin-design-system/v3.0.2/components/catalog.json",
      "human_url": "https://github.com/yehyakin/kin-design-system/blob/v3.0.2/components/catalog.json",
      "schema_version": "1.0.0",
      "catalog_version": "1.6.0",
      "reviewed_on": "2026-07-30",
      "entry_count": 80,
      "status_counts": {